,video_title,title_topic
0,i asked her to be my girlfriend...,3
132,prepping my apartment for my boyfriend to move in!,3
134,labrant family baby boy name reveal.,8
145,baby boy is here! *official labor and delivery*,0
110,surprising thomas with a motorcycle!!,4
114,rating my wife's pregnancy outfits,8
151,boatbuilding - lining-out for planking (ep78),9
153,the proposal part 2 she said yes!,9
192,cinemassacre channel update 2020,9
29,being replaced.,2
31,"here's why we do sponsored videos, what are your thoughts?",1
39,my dog goes swimming for the first time!,0
44,i took a pregnancy test...,9
24,this is the end.,5
10,i don't know what im doing anymore,2
11,try not to laugh challenge #51,2
15,ten minutes with tyler cameron | q&a,2
17,our farm got destroyed.,3
81,my first day of school vlog  *senior year* 2020-21,3
86,live birth of our baby boy *emotional*,8
74,exposing my browsing history!,5
53,first day in the new house! ellie and jared move in!,2
234,do our parents approve of our engagement? q&a with both families,1
241,mint mobile plus,2
410,the sidemen play fall guys (sidemen gaming),4
620,jamie foxx gave me a black eye,1
619,miley cyrus vlog,1
829,we have some explaining to do...,8
838,going on a date with my crush (awkward),2
840,snoop dogg - nipsey blue (official video),4
802,dixie's $30k birthday gift mission | charli d'amelio,4
806,the boys read mean tweets,9
1032,i watched spider-man: homecoming in 0.25x speed and here's what i found,0
1033,meet my blind boyfriend!,5
1002,2 very independent baddies getting ready  or whatevah (funny af),1
1011,i kept her a secret... (the reveal),8
1012,sidemen guess the fake rapper,0
1013,$4 pancake vs. $88 pancake,1
1019,still reacting to every tik tok community before it gets banned... i regret this.,7
1252,monstermax grenades climbing a 200ft dune,4
1426,joe rogan experience #1527 - david blaine,2
1448,we try the world's weirdest pies (eat it or yeet it #15),3
1402,my overdue apology.,2
1403,showing my friends our  new collection | charli d'amelio,4
1646,the dixie d'amelio show episode 01,6
1802,we can't hide this anymore!,8
2041,the life of brayton & aython (part 6),8
2021,fivio foreign - 13 going on 30 (official video),4
2240,the kulture study: bts dynamite mv,6
2255,"bts to release 'dynamite,' their first entirely in english | usa today entertainment",4
2433,"liam payne - tiktok with jeremy lynch, danny devito and 1d, the lp show act 2 & aftershow!",0
2403,a day in the life: addison rae,6
2411,$4 rice vs. $52 rice,8
2618,freedom fan mail ep.5 - boat load of car parts and random items!,9
2622,asmr ratatouille mukbang 먹방 | cooking & eating sounds | zach choi asmr,1
2835,nessa - pain [live acoustic],7
2804,our sit down interview | the d'amelio family,0
2811,try not to laugh challenge #52,2
2873,euphoria live | labrinth x mini-mart performance | hbo,1
3038,lachlan’s new pwr car wrap! (tesla model x),1
3076,i spent 100 hours in the strongest cage! challenge,4
3077,200 farmers stay silent during auction so man can buy back his beloved family farm,3
3202,my husband passed away | telling his story,0
3500,guess which beer challenge ft. vlex,0
3404,hitting rock bottom,1
3646,getting serious with my rv build series,7
3601,childhood crushes 3,3
3604,what really happened,3
3619,the dhar mann experience,8
3600,how the boys met,6
3651,"asmr - face tapping away anxiety (eft, whispered)",3
3835,the dixie d'amelio show with addison rae,4
3838,i'm failing,1
3839,wonho 원호 'open mind' teaser,3
3806,the prince family official baby gender reveal!!,8
3807,$4 breakfast sandwich vs. $30 breakfast sandwich,9
3850,41 and pregnant,2
4043,*exciting renovation update* i have so much to show you!,4
4003,david blaine ties dixie to giant balloons  | the d'amelios,5
4015,i made a chic-fil-a crunchwrap,4
4234,walmart back to college | however you study,6
4210,please help me get my brother out of prison,9
4438,he proposed! *dream come true*,8
4401,youtube just gave me a strike...,9
4451,brad mondo reacts to me ruining my hair,7
4465,bought my girlfriend her dream car!!!,3
4835,we caught a cat!!,5
5023,vma 2020 fashion review,1
5240,heavy rainstorm flooded our basement! busted window and rushing water!,2
5247,labor & delivery of our baby!,0
5203,i tried acrylic pour art for the first time,6
5205,fighting addison rae | dixie d'amelio,4
5215,we got married,7
5258,cutting for propeller / boring for prop-tube ( wooden boat rebuild / ep80),6
5264,$5 carrot vs. $20 carrot,0
5418,asmr steak & cheese sandwhich mukbang 먹방 | cooking & eating sounds | zach choi asmr,1
5419,xbox series s revealed,9
5473,why we left vat19,4
5605,behind the scenes of my sailor photoshoot,8
5606,blake gray meets my mom *vlog* | amelie zilber,7
5608,try not to laugh challenge #53,2
5613,mcdonald's new travis scott meal review !!!,7
5810,ryan & rick moranis,1
5851,earphone challenge *gone wrong*,4
6001,jake paul - 23 (official music video) starring logan paul,9
6031,we learned a lot about ourselves | the d'amelios,1
6211,showing you what happened to me,7
6213,we bought an abandoned storage unit,4
6224,"launching a $40,000 firework!",3
6409,"spoiled wife fires housekeeper, instantly regrets it | dhar mann",5
6413,i've never blinked in my life,1
6611,$4 quesadilla vs. $20 quesadilla,9
6619,never do this in a public bathroom,1
6620,our baby's gender & name reveal! (surprise gender),8
6828,bad news.....,5
6830,"blac chyna does asmr with orbeez, talks beginning music, reality tv & more | mind massage | fuse",0
6832,[bts universe story] official trailer,0
6833,"new apple watch 6, ipad air and... no iphone?! sept 15th apple event rumor round up!",7
6802,zane - wap (official music video cover),2
6814,"guess the number and win a $1,000,000",8
6815,dating sommer ray for 24 hours!!,2
7027,"apple watch series 6, apple watch se and new ipad air!",7
7031,nice morning,5
7002,what's in my bag,4
7082,recreating iconic movie scenes,0
7072,julie and the phantoms - julie sings bright with the phantoms (episode 2),9
7059,i filled a swimming pool with money!,1
7200,exclusive behind the scenes for my new music video | dixie d'amelio,4
7234,stray kids back door dance practice video,6
7235,surprising hype house with puppies,8
7262,i miss her...,5
7431,apple watch series 6 and se unboxing and first impressions!,6
7444,this is all for you,0
7630,she's ready to leave,9
7631,i am the world’s greatest samurai,3
7649,the aguilars official pregnancy announcement video!,8
7801,*ios 14* iphone customization + organization tips/tricks! must do!,7
7804,how to create an aesthetically pleasing iphone with the new ios 14 update! | step by step!,7
7858,life in the bubble: ep. 15 -  2nd round lal v. hou: part 2 + team trivia night! | javale mcgee vlogs,0
8133,introducing the dumb house,3
8121,dixie d'amelio - be happy (ft. blackbear & lil mosey) [remix] official music video,7
8031,how to customize your iphone with ios 14! (minimal iphone organization),7
8019,how to customize app icons on iphone (ios 14) | kayla's world,7
8050,"rare rattlesnake, duck hunting & cooking, building an off grid root cellar, wild mushrooms",9
8061,stray kids 미친 놈 (ex) video,5
8240,hoist your bike (installation and review),1
8200,pool stereotypes (bloopers & deleted scenes) | dude perfect plus,3
8249,asmr naruto ramen mukbang 먹방 | cooking & eating sounds | zach choi asmr,1
8641,horrible halloween trixie makeup on trixie mattel | brittany broski,6
8607,le di dulces mexicanos a james charles 🤣 (reacción) probando dulces mexicanos 🇲🇽kimberly loaiza,4
8616,first day of riverdale season 5! | madelaine petsch,6
8679,i watched wandavision trailer in 0.25x speed: breakdown - part 1,0
8830,aviation gin homeschool edition,4
8821,swapping our house with the labrant fam!,3
9034,jlo asked me to be in her music video | charli d'amelio,4
9055,dying my hair from black to brown + husbands reaction *so cute*,9
9200,"style swap ft. noah beck, james charles & blake gray",9
9425,stray kids 아니 (any) video,0
9401,the dixie d'amelio show with noah beck,4
9600,things really got out of control | the d'amelios,3
9621,monstermax vs tank & demolition ranch,1
9846,making lexi try my favorite mexican candy!,2
9805,the sidemen play among us (sidemen gaming),4
9818,i tried these snacks for the first time | charli d'amelio,4
9850,new dream home mansion tour!,9
10210,fivio foreign - bop it (feat. polo g) [official video],2
10259,we'll miss you,4
10431,maximum jackman,1
10402,tmg - sofia (official video),6
10404,david's perfume - by david dobrik,0
10412,sidemen play among us but everyone has -200 iq (sidemen gaming),2
10640,rydel's surprise love song for capron (emotional first dance),3
10690,10 things you didn’t know about me,9
10803,the aguilars official gender reveal!!,8
10804,the dixie d'amelio show with lil huddy,4
10816,trailer tomorrow. probably.,0
10818,sidemen play among us but everyone acts sus (sidemen gaming),4
10877,fitting/polishing bronze knees - wooden boat rebuild (ep82),7
11026,snap dogg: ddg is the only rapper i've seen that can really fight (part 3),3
11032,asmr cheese wheel mac & cheese mukbang 먹방 | cooking & eating sounds | zach choi asmr,1
11002,kylie jenner: halloween cookies with stormi,2
11005,free guy trailer 2,5
11052,sade – this far 2020 – promo (one),9
11200,we took over a candy store for the day | charli d'amelio,4
11201,i tested clickbait soap art hacks,2
11207,the truth about our relationship | hannah brown & tyler cameron mukbang,9
11208,what really happened,3
11436,blake dyes my hair *night routine* | amelie zilber,6
11440,one month after rescuing stray cat!,5
11455,what color was this dress? | story of the internet's dumbest controversy,2
11625,there are 62 kidz bop albums (and i review all of them),0
11806,my slime review | charli d'amelio,4
11817,nessa barrett - if u love me [official music video],3
11857,my apartment makeover!,4
12032,why i went to hospital (again),1
12014,my miu miu makeover for fashion week!!!,1
12058,official fan club name unveiled! - enhypen (엔하이픈) (eng/jpn),6
12226,a different kind of membership. walmart+ | mobile scan & go,6
12232,finding out we're pregnant on camera! *emotional*,0
12239,a different kind of membership. walmart+ | the cox family,8
12206,wow..we're like..parents now...,8
12261,morning snuggles with matteo!,7
12445,saying goodbye,9
12399,kylie jenner: my mom does my makeup,2
12626,what happened to simon?,1
12630,why we joined bon appétit,8
12636,roy jones jr. on facing mike tyson,9
12638,sidemen play among us but tobi gets his revenge (sidemen gaming),2
12643,she regrets this.. **pray for shyla**,9
12607,why i’ll never wear these scrubs,6
12610,telling our family we are pregnant! *emotional*,0
13023,unsolved: true crime • season 7 trailer,2
13032,get ready for a zoom date with me!,8
13016,we are nba champions!!! | life in the bubble - ep. 18 (season 1 finale) // javale mcgee vlogs,8
13200,the eerie vanishing of the flannan isles lighthouse keepers,5
13210,if everything was like among us,0
13248,i failed card swipe 30+ times live in front of 200k people and all my friends,6
13406,a day in the life with catherine,5
13716,jigglypuff doesn't deserve rights,4
13599,alaïa's 2nd birthday party special!!!,3
13600,the untold truth about team 10 (reuniting with chance),1
13649,the history of halloween,8
13683,insulating on top of the cabin roof...but why? / log cabin update- ep 13.15,1
13684,highlights | resumo: sporting 2-2 fc porto (liga 20/21 #4),2
13659,a secret i've been hiding...,4
13802,my first billboard music awards!!!!! | addison rae,6
13850,i moved?! | kelianne stankus,0
14030,liam payne live,7
14033,iphone 12 pro: camera test! is this the best camera of 2020?!,9
14007,iphone 12 and 12 pro unboxing!,8
14238,flannan isles lighthouse q+a,7
14198,surprising best friend with borat!!,1
14202,the dixie d'amelio show with trippie redd,5
14210,finding out we're pregnant | sadie robertson huff and christian huff's pregnancy story!,9
14402,rating my halloween costumes,6
14405,who's most likely | the d'amelio family,4
14409,weird amazon movie trailers,3
14411,we went to therapy...,3
14606,the daring heists of the elusive pink panthers,1
14681,marisha and matthew engagement video highlights,1
15041,the dixie d'amelio show with jaden hossler,2
15201,halloween stereotypes (bloopers & deleted scenes) | dude perfect plus,3
15505,psa: don’t shave your pomeranian,8
15454,my dog logan meets my new puppy for the first time!,3
15459,our family is growing by 1,4
15464,playstation 5 unboxing! ps5 is here!,2
15466,i bought a house ! ( empty house tour ),4
15600,finding out i'm pregnant! | the herbert's,0
15601,things really got out of control again | the d'amelio family,3
15650,another family is moving into our house.,4
15657,snoop and his xbox series x fridge,9
16037,our wedding i audrey and spencer,7
16001,"baking halloween treats with my best friends ft dixie, chase, james, noah & larray | charli d'amelio",5
16002,"best friends buying each other costumes ft. james, charli, dixie, noah, chase",5
16008,"carving pumpkins with my best friends ft charli, noah, james, chase, & larray | dixie d'amelio",5
16009,jake paul & mike tyson (official fight trailer),9
16010,the suspicious death of harry houdini,4
16020,reviewing old halloween costumes,6
16237,addison rae and bryce hall hold hands and blush talking about what they love about each other,1
16215,$7 picnic vs. $323 picnic,6
16398,getting ready with larray!!! | addison rae,1
16416,i lost 1/3 of my hair.. emotional (storytime),4
16632,drawing only cute girls! inktober 2020 sketchbook tour,0
16615,brad mondo reacts to my hair | charli d'amelio,4
16828,it's a boy!! *surprise gender reveal*,8
16803,why we haven't been seeing everleigh as much recently.,0
17034,fully furnished apartment tour,4
16998,mike will made-it - what that speed bout?! (feat. nicki minaj & youngboy never broke again),9
17002,we fostered three puppies | the d'amelio family,2
17199,i let the instagram shop tab pick my outfits,4
17208,the sudden disappearance of cynthia anderson,6
17404,i'm pregnant!!,0
17628,lindsay gives birth to baby girl sage!! *emotional*,8
17616,$1 savory pie vs. $55 savory pie,0
17803,skateboarding with tony hawk!!! | addison rae,1
17804,ufc golf battle (behind the scenes),8
17807,behind the scenes of my leopard collection video shoot,0
17813,my official house tour!!,4
17816,i won’t lose - jake paul vs nate robinson (episode 1),9
18033,karens & cancel culture w/chelsea handler - uncomfortable conversations with a black man ep.10,6
18018,forgiveness,0
18208,we’re married! | cole and charisma,0
18417,life after losing my husband,0
18463,unliminted,5
18637,reacting to my draw my life... 6 years later,0
18618,"this is funny, i promise!",7
19023,$18 oil vs. $60 oil,1
19005,unus annus - post mortem,0
19198,our first mystery guest | dinner with the d'amelios,5
19209,finding out i'm pregnant + telling my husband,0
19250,enticemint,8
19256,i won’t lose - jake paul vs nate robinson (episode 2),9
19438,"faze adapt vs faze rug - $10,000 1v1",9
19401,if everything was like among us 3,0
19402,terrorizing my friends in proximity chat among us,4
19409,numbaa7: i spoke to mo3 right before he was murdered (part 1),2
19412,trapping karl,5
19626,daily dose of gaming live stream,7
19623,her water broke **not clickbait**,3
19599,playing among us with pro players,9
19600,dream - minecraft hitmen extra scenes,3
19621,behind the scenes of my kylie x grinch shoot,2
19801,kylie jenner: grinch cupcakes with stormi,2
19851,"last to stop jumping wins $5,000! (girls edition) part 2",5
19860,we are moving in together !!!,4
20244,i'm getting a divorce... full explanation vid (plus fishing with reggie),3
20219,nobody likes you when you're 29,8
20200,the dixie d'amelio show with charli d'amelio,4
20204,dhar mann holiday special: 4 stories that will change your life,8
20247,cody and noel do: drunk baking,9
20399,among us in minecraft...,1
20414,our first serious injury at cleetus and cars (driver is recovering!),3
20632,adam22 & lena birth vlog - shocking last minute c-section,1
20640,try not to laugh challenge #58,2
20605,fortnite money wars pwr tournament! ($$$),3
20617,dude perfect corn maze (behind the scenes),0
20821,oh baby! it's a ..... | gender revealed!!!,8
20798,i can’t beat this,7
20851,stray kids 타 dance practice video,7
21002,dream - minecraft manhunt extra scenes (4 hunters finale),1
21005,making a bismuth knife to undo an injustice,0
21203,admitting when i'm wrong.,1
21208,fivio foreign - trust (official video),4
21419,my first nfl touchdown!!!,4
21640,i recreated *iconic* movie scenes,2
21602,the dixie d'amelio show with larray,4
21649,azula's r,0
21653,the 2021 dodge charger srt hellcat redeye is the world’s fastest sedan,3
21832,euphoria: special episode part 1 | official trailer | hbo,1
21797,the truth about us,1
21805,what does my dad think about me getting a bbl?,2
22033,my room,8
22049,the pregnancy results are in!!! (we're pregnant),0
22065,"why i'm moving, the rest of the story",4
22231,zonnique - #ftcu [official video],2
22204,catching up with da rock’s siblings... she a model now and i’m still a baddie,7
22272,our official vlogmas intro! |riss & quan,6
22428,match made in hell,6
22400,our gender reveal! | the herbert's,8
22411,when satan met 2020,5
22416,coke & mentos with salem ilese | the d'amelio family,0
22451,the ace family's new intro video!!!,4
22828,sidemen find out their football stats,4
22799,technoblade meets vikkstar & lazarbeam on dream smp,8
22845,our worst dating experiences,1
23032,logan paul vs floyd mayweather.. can logan win?,9
23042,we failed our inspection | building our own house,3
23005,floyd mayweather set to fight logan paul — here's what he said about returning to the ring in sept.,9
23006,"fresh's $1,000,000 office tour! (hosted by lazarbeam)",8
23065,ohgeesy - bandemic (e.d.d.) [official music video],4
23233,try not to laugh challenge #59,2
23199,if everything was like among us 4,0
23245,"this is uncomfortable for me to talk about, but we should talk.",1
23249,heading to the hospital to give birth to treu ‼️💕 ( vlogmas day 6❤️🎄),2
23401,the dixie d'amelio show with james charles,4
23633,airpods max 🎧 unboxing and first impressions!,6
23675,im moving to la ..😳😊| vlogmas 2020,9
23829,nessa barrett - santa baby [official music video],3
24214,uncle derek got married!,7
24197,the lie detector with noah beck | the dixie d'amelio show,4
24257,we ran out of steel ...at the worst time! / log cabin update- ep 13.18,1
24420,minecraft's history of glitches,8
24622,she's here! :d,4
25023,i moved to england & my new apartment tour!,4
25005,christmas tree decorating contest w/ princess lol,9
25225,"crazy video! blizzard in new york, usa (dec 17, 2020)",5
25226,cody and noel do: drunk baking (pt. 2),8
25431,pichi is making friends,2
25412,they sussed us both from round 1.. (proximity chat among us w/ dream),4
25621,if everything was like among us 5,0
25635,my guide dog retirement plan + my next dog… *very emotional*,4
25639,#ad | i surprised the sidemen with gifts for 10 million subscribers,3
25831,"day 2: stranded on an island until 1,000,000 subscribers.",3
25835,teetee - back at it (official music video),4
25799,filipino food *galore* mukbang - moms foodtruck is here,5
25800,reindeer christmas prank (behind the scenes),0
25802,vlog #1: q & a sneak peak,1
25815,holiday special with dwayne johnson: some good news with john krasinski,4
26029,shocking ultrasound... twins?! | lauren & arie,9
26044,asmr mozzarella corn dogs mukbang 먹방 | cooking & eating sounds + thank you for 10 million subs,8
25997,best friends play white elephant | dixie d'amelio,4
25999,best friends omegle christmas carols with fans | charli d'amelio,4
26000,the truth behind our friendship,5
26017,try not to laugh challenge #60 - gauntlet w/ our crew!,2
26047,we tasted mr. beast burger restaurant... (here's what happened...) *full menu*,7
26200,did dream fake his speedrun - response,4
26206,"rich dad can't buy daughter's christmas wish, ending is shocking | dhar mann",8
26257,dhar mann christmas special: a december to remember,6
26422,telling my fiancé i’m pregnant | dhar and laura,0
26598,kylie jenner: christmas decorations 2020,2
26812,the ace family christmas special 2020!!!,3
27027,testing old wives tales gender predictions + baby gender reveal!!,8
27217,vlog #1: q & a,1
27200,my apology,9
27427,super siah - cool mom ft lady boss official music video,4
27396,goodbye california. a new chapter.,9
27399,"among us w/ corpse, james, addison, bretman, karl, george, poki, and more :)",3
27446,“brodie” - being the elite ep. 236,5
27456,drag queens official video hazel aka monique samuels,0
28005,im pregnant!,0
28228,if everything was like among us *bloopers 2*,5
28397,something we want to tell you!,7
28404,markiplier isn't real,7
28407,allergic reaction after saying yes to the dress,1
28412,deadpool 2 monologue,8
28626,i'm leaving funhaus... sort of.,7
28600,"i ruined her birthday, then surprised her with her dream car!! **emotional**",3
28611,delicious carne asada quesadilla,5
28655,addressing rumors & upstairs house tour! | carly waddell,3
28996,saweetie - best friend (feat. doja cat) [official music video],3
29006,"he bet $20,000 on a coinflip, and won",9
29422,kristin's wife comes out as trans,0
29598,finding out i'm pregnant,0
29604,sneaking into a movie theater for 24 hours!,7
29615,i'm pregnant !,0
29799,welcome to the world,8
29800,rc frogger fails,2
29804,are you subscribed?,4
29806,markiplier is real,1
30198,how lebron was when he found out james harden went to the nets,5
30202,georgenotfound in his natural habitat...,7
30421,filling my entire house with orbeez!,1
30430,why i took my wedding ring off | young widowed mother,0
30432,"upgrading the cleeter merch room, time to build a man cave!",7
30417,baby name reveal- princess a 💕,8
30404,lebron just tweeted about us!!!!!,9
30407,dream in minecraft manhunt...,1
30408,giving away karl’s car,3
30627,surprising my boyfriend for his birthday *emotional*,5
30599,telling benny i'm pregnant!,0
30820,we're the greatest crewmates - among us song,8
30814,i had covid-19 ...while pregnant,0
31028,hello world . from jennie,8
31042,i bought everything inside this warehouse without looking at it first!  😅💸,4
31000,we found a key frozen in ice…,2
31197,destroying my grandpas truck and not buying him a new one,8
31427,let's talk...,1
31438,asmr lasagna mukbang 먹방 | cooking & eating sounds | zach choi asmr,1
31421,euphoria: special episode part 2 | official trailer | hbo,1
31420,try not to laugh challenge #62 - prop tart!,0
31396,we are one | biden-harris inauguration 2021,3
31601,our white house: an inaugural celebration for young americans hosted by keke palmer,2
31824,we're pregnant!,0
31837,q&a with naisha,2
31834,"kyle from nelk gives his dad $300,000 to retire!",5
31820,thank you for 1 million subs!,9
32233,nas - 27 summers (official video),8
32197,escaping 100 layers of cardboard! we're trapped!,7
32420,minecraft size mod funny moments ft. quackity & sleepy bois inc. / mcyt animatic,4
32400,my message to conor mcgregor.,9
32408,forced off youtube - full fbi story,8
32631,tokopedia x blackpink : pretty savage di #tokopediawib tv show 25 januari 2021,5
32597,game night stereotypes (bloopers & deleted scenes),3
32613,the moment i found out i was pregnant!,0
32801,i met corpse on the dream smp!,8
32873,godzilla vs. kong – official trailer- reaction and review!!! | mackeyfam,1
32867,autotuned bees - animatic,8
33043,touring demolition ranch's abandoned mansion project!! (view is amazing),1
33228,tayler does my makeup for the first time!,6
33220,i don't know,2
33196,if everything was like among us 6,0
33434,morgan wallen – bandaid on a bullet hole (official lyric video),7
33403,what happens after conor mcgregor's loss to dustin poirier?,0
33616,our baby boy name reveal,8
33601,"the entire history of minecraft, i guess",0
33651,wagyu burger,8
33824,resolve || dreamsmp animatic,2
33840,finding the secret dream smp treasure!,8
33816,moms rate each other's cornbread,3
33817,we’re engaged! he staged a fake water rescue for the sweetest surprise proposal ❤️ (tyler & angela),0
34232,when a dope boy finds out he's facing 20 years! kountry wayne,0
34233,try not to laugh challenge #63 - hard mode!,4
34207,i play geoguessr,4
34434,day 5 of trying to build my spice tolerance,2
34415,attempting the spicy noodle challenge pt. 1,2
34401,jake paul reads a poem to floyd mayweather,9
34405,when a dope boy buys ludacris stolen car! kountry wayne - ft. ludacris & desi banks,0
34409,our new house!!,4
34634,beauty and closet storage room tour,4
34816,dope boy tries to get ludacris to give him a record deal! kountry wayne - ft. ludacris & desi banks,0
34805,dream ft. pmbata - roadtrip (official lyric video),7
34811,we bought a house together!,4
34851,day in the life when shooting riverdale | madelaine petsch,4
35017,a new beginning...,8
34998,kylie jenner glam on caitlyn jenner,2
34999,dream - minecraft manhunt extra scenes (grand finale),1
35240,we received the first gift from the usa,2
35202,ddg official house tour 2021!!,4
35207,speaking only chinese to my friends for 24 hours!!,0
35432,meet the cast - following bretmanrock mukbang,9
35433,"welcome to the world, baby extended cut | huggies®",0
35393,i bought a new house!! (2021),4
35395,ty quits dude perfect?!?!,7
