,video_title,title_topic
71248,why moose get violated by killer whales (and why octopus punch fish),4
71438,which one is your favorite drawing art artist,3
71394,dream - minecraft manhunt assassins extra scenes,1
71404,we fed five cities in 30 days!,6
71629,baby meets family...,3
71601,last to leave 100 buttons but only one escapes!,8
71615,enhypen (엔하이픈) x tayo - 'hey tayo' official mv,6
71823,our new house tour! *we hope*,4
71811,dumb ways to die in among us *song*,6
71815,design fails that are so bad its actually funny,6
72046,"say the same word for $10,000",8
72225,shark tier list,8
72234,behind-the-scenes at team usa practice + olympics photoshoot with the squad! | javale mcgee vlogs,2
72394,next level reynolds,9
72398,filling my entire house with packing peanuts!!,1
72410,live pregnancy test!!! (pregnancy announcement) baby #4,8
72412,ferran's 11th birthday party surprise!! 🎂🎁 | the royalty family,0
72621,how to play gta 5 #shorts,8
72602,minecraft but everything is op!,1
72609,binging with babish: death by chocolate éclair from the simpsons,5
72819,finger chopper (crazy illusion) 🤯🤫 #shorts,7
72810,help me,4
73020,serving alondra doo-doo butter! *her reaction*,1
73033,i bought my dream car!!!,3
73079,trolling opponents in basketball #shorts,8
73067,millennial farmer the dirt track modified racer in action,6
73220,finding out if we got the house!,0
73228,we got hit by lightning!! (this is not a joke),2
73235,i built a huge lego rollercoaster - floor to ceiling!,8
73200,i tested clickbait diy candle hacks,7
73208,nessa barrett - 'i hope ur miserable until ur dead' (official music video),2
73242,the truth about me and joy ❤️🤪,1
73414,new workshop! ..moving in & tour (ep103),4
73816,making silver from ore i found in an abandoned mine,2
73802,we did this at my 1st concert! **must watch**,5
73804,the largest and most stuck excavator i’ve ever recovered,3
74022,liangelo ball- 2nd game breakdown (teammates too slow for him),9
74030,shock collar flight simulator (bloopers),3
74032,binging with babish: meg's dinner from family guy,4
74034,will sarah impress the sharks with her fire hose fitness tool? | shark tank us,9
74011,try not to laugh challenge #76 - hard mode,2
74012,surprising benny with this!!!!,8
74227,"cali broke her leg, we rushed to the hospital",3
74409,here is why messi rejected neymar’s offer and chose №30 shirt at psg!,0
74621,i took a positive pregnancy test...but there's more.,9
74592,sub urban & bella poarch - inferno (official music video),4
74606,the story of minecraft,8
74650,best supporting actors,9
75016,giant toilet is lava green #shorts,2
74991,i got my wisdom teeth pulled | charli d'amelio,9
75009,liangelo ball- 4th game breakdown (shows he’s ready for the nba),9
75216,my friend killed this guy's pet on the onetry smp *war* #shorts,8
75228,found a star and a couple of other gems sitting on the beach yesterday.,6
75212,the future of cerro gordo is in danger...,0
75202,reacting to our old youtube videos!! ft. lexi rivera,9
75206,mental health doesn't discriminate feat. lil wayne - uncomfortable conversations with emmanuel acho,7
75208,pov your soulmate's b0dycount appears above your head...,1
75427,my mom is a pop star🌟,8
75399,brushing out my 5 1/2 year dreadlocks | christina randall,9
75409,minecraft but all items are massive!,6
75623,guess who's back!!,0
75806,minecraft fans...,3
75814,i have something to tell you,7
75817,our worst nightmare,8
75991,a new chapter | de'arra & ken,9
75997,dream & alec benjamin - change my clothes (official lyric video),6
76215,california road trip part 2 (usa travel vlog) | bea alonzo,3
76405,the merchant...,0
76611,23.08,3
76817,try not to laugh challenge #77 - green screen edition!,2
76824,animals that got the middle finger from evolution,1
76828,submarine minefield battle | behind the scenes,7
76993,i watched spider-man: no way home trailer in 0.25x speed and here's what i found,0
77232,our land purchase,8
77204,revealing our baby's name!!! + meet our baby girl! (birth vlog pt. 2),8
77398,saying goodbye to our house… leaving california,3
77399,changing my best friends life,4
77405,dream minecraft manhunt epic moments (tier list),8
77408,coming out...,5
77622,teaching itsoraida and the badwiggies how to play soccer!!!,5
77592,introducing monstermax 2. the worlds largest truck (twin engine duramax),3
77604,embarrassing childhood stories,6
77657,capella grey - gyalis [official music video],0
77806,i watched spider-man: no way home trailer in 0.25x speed and here's what i found (part 2),0
77808,"minecraft but, i can’t touch the color white…",8
78020,reacting to jake paul vs tyron woodley ... *my thoughts* wonderboy thompson,9
78015,fishing: how to fishing easy #shorts,4
77995,i went vintage shopping across asia,9
77997,kay flock - being honest (shot by  ringring visuals),2
78003,kanye west - donda (official audio),7
78006,gët busy [official music video],7
78010,building a 5 acre pond! (filling it with water),1
78011,kanye west - hurricane (official audio),7
78220,chainsaw carving competition (ot 29 outtakes),0
78224,merkules - ''nerves'',8
78238,they made me do it!!,0
78614,kanye west - come to life (official video),7
78606,i went over speed house and my brothers pulled up.... didnt go so well,5
78824,falling into the genshin impact hole,9
78825,how to master the zandvoort f1 track! | nico rosberg | dutch gp 2021,5
78830,my surprise bday trip!! *i forgot most of it*,2
78817,official moving day!,4
78804,i got hunted by 1000 chickens!,4
78807,everything has to end.,5
78865,our official gender reveal❤️,8
78998,monstermax 1’s new replacement,4
79425,mocking up the interior (rebuilding tally ho / ep105),9
79407,all about tha (boom!)” adam cole aew entrance theme | aew music,6
79409,building a 5 acre pond! (hurricane update),1
79623,spotemgottem talks being accused & wanted for a murder in dallas because of rap lyrics (part 1),3
79630,speed and i became parents for a day**we not ready**,0
79604,dear baby... | our rainbow pregnancy after 6 years of infertility,8
79606,b lovee - neaky (official video),0
79609,live pregnancy test! emotional results,0
79649,hello friends,8
79819,my 18th birthday trip to aruba with my boyfriend,5
79816,teaching bretman rock how to play roblox,2
79837,"lil durk brings otf to jewelry unlimited and pulls out $100,000 cash to get icy !",8
80030,school lunchbox ideas | italian pasta salad,2
79995,dexter: new blood (2021) official trailer | showtime,4
79999,minecraft but zombies multiply!,7
80007,pete davidson started taking singing lessons as a joke | the tonight show starring jimmy fallon,1
80227,first day in new house… tornado warning!,2
80209,worst basketball ever,7
80393,lisa: lalisa (tv debut) | the tonight show starring jimmy fallon,1
80426,i jumped across a street,9
80435,overprotective big brothers react to lil sister's cringey tik toks! 😂,2
80427,never have i ever ft. benny soliven and cristianblends,8
80398,"i searched 1 trillion seeds, here's what i found",7
80408,first basketball ever created,7
80457,i watched what if ep. 5 in 0.25x speed and here's what i found,0
80599,renovations and construction!! *flipping my house*,5
80640,our gender reveal!,8
80819,"kelly, john and blake await ariana's grand entrance | the voice 2021",3
80813,"stray kids 강박 (방찬, 현진)” video",4
80801,styles p versus chad ochocinco johnson |  is kanye vs drake too messy for hip-hop,7
80807,kay flock - psa (official video),2
80842,membrane sweep led me into the hospital...,5
81031,welcoming the first ace family dog!!!,5
81003,gender reveal for baby #4 + our reactions!! 💙💗,8
81004,try not to laugh #78 - shayne's birthday!,2
81006,bucket list: walking on a plane (bloopers),5
81217,first basketball shoes ever,7
81221,#pov : the amount of 💰 you have is above your head🥺💔 #shorts #viral #meme #jakepaul #funny #sad,4
81226,"iphone 13, ipad mini and apple watch series 7 updates! #appleevent",7
81231,"tim cook post apple event interview! iphone 13, apple watch series 7 and new ipad mini!",7
81206,met gala 2021: get ready with me | hailey rhode bieber,8
81268,the kid laroi & hailey eat australian food & play real life would you rather | who’s in my bathroom?,8
81241,if only rude fans at races could understand this...,5
81433,hangin' with dashie #34 (2021),8
81434,after 3 years of infertility this happened | our fertility journey episode 4,3
81399,no need for lies,1
81405,ultimate football challenge w/ santi & alexis marie!!,8
81407,the struggles of moving with a baby,8
81449,when they don't have chicken nuggets,7
81619,last to leave the circle wins $1000!!! (influencer edition),5
81621,vaughn mugol's beautiful performance of ed sheeran's the a team | the voice blind auditions 2021,1
81624,iphone 13 and iphone 13 pro | what's new?!,7
81625,meeting baby romero!!,1
81626,i did the longest backwards shot (83 feet),4
81596,pricked 🧡 palette & collection reveal! | jeffree star cosmetics,1
81819,losing a parent,8
81993,"7,000 year old toothbrush vs future toothbrush !!",8
81994,my new house tour | de'arra taylor,4
82007,this is the end,5
82010,couples when they start dating.. 😭💀 #shorts,1
82220,ariana grande reflects on moving to la for victorious,3
82226,wtf is this cursed?#minecraft #shorts,2
82235,no shelter thunder storm stealth camping,6
82200,"chad johnson | if you're good enough you don't need an alabama,  go to an hbcu.",2
82209,surprise marriage proposal gone completely wrong 💀😕 #shorts,1
82421,binging with babish: isotope dog from the simpsons,0
82422,met gala 2021 fashion review,8
82428,girl named tom's four-chair turn performance: helplessly hoping | the voice blind auditions 2021,7
82435,"minecraft, but i’m hunted by a giant!",1
82437,white house chef turns kfc gourmet🐔😳,7
82396,dream - minecraft manhunt extra scenes (5 hunters finale),1
82397,"gymani kills it, singing ariana grande's pov in front of ariana | the voice blind auditions 2021",4
82398,helping hurricane survivors,5
82403,iphone 13 | unboxing all new models!,4
82406,iphone 13 pro review | cinematic & macro mode!,7
82409,tearing my house down!! *kitchen demo*,8
82616,charli vs chase cupcake competition | charli d'amelio,4
82623,how my mom grounded me🥴,5
82627,we're having a baby!!,8
82598,pov: you enter the elevator,9
82896,dog pranks🐶😂 #dog #viral #comedy #funny #animal #prank #greatdane #roblox,7
82792,73 questions with kylie jenner | vogue,7
82800,muppets haunted mansion | official trailer | disney+,9
82885,chavon rodgers sings olivia rodrigo's hit driver's license | the voice blind auditions 2021,7
82859,big chief's new engine for the crow!! caddy jack's nitrous header build & sneak peek!,3
83025,beating minecraft in one chunk!,8
83003,pov everyday you have to pay the government a fee or else…,1
83004,rosalía y tokischa cantan 'linda' | premios billboard 2021 | telemundo entretenimiento,6
83011,pov youre assigned a certain amount of laughs each year…,4
83012,bigwalkdog - trap god (feat. gucci mane) [official music video],8
83051,pov on your 18th birthday youll get to know what age youll meet your soulmate…pt.2,5
83053,mountain man breakfast | hearty breakfast casserole,7
83224,pov: you and your minecraft friend argue about who has more stuff,7
83198,i wore digital clothes for a week,4
83266,karol g interpreta sus éxitos en los premios billboard 2021 | telemundo entretenimiento,9
83283,introducing kylie baby,3
83419,#pov : you know when people lie🤥🔥 #shorts #viral #funny #jakepaul #meme #minecraft #trending #skit,4
83394,"20,000 bristle vs 20 bristle toothbrush!!",5
83401,heartbroken,1
83405,pov on your 16th birthday you can win a prize for following instructions…,9
83408,the yes or no game *pranks* #shorts #funny,8
83410,weirdest pizza delivery,0
83468,people who won the food lottery #shorts,7
83665,"michael jordan and stephen curry talk ryder cup, golf, basketball",7
83624,he left us.....,3
83638,"dez bryant | his mother, jerry jones and colin kaepernick - part one",5
83616,i'm late to this viral ramen hack,5
83603,we're moving to texas!!,4
83604,optical illusion trick shots (behind the scenes),4
83611,even tjass can’t cure deanobballin 😭 #shorts,2
83671,avocado & honey,3
83666,turning a hay field into my yard! (very satisfying),7
83795,try not to laugh challenge #79 - hard mode w/ gus johnson,2
83801,pov you get an item you have to use everyday or else…,7
84024,what now... | who is ken,0
84027,pov you can see everybodys darkest secrets…,3
83997,the prince family got into a very bad car accident **cops pulled up**,3
84203,i turned my cat into lego!,8
84418,i'm scared of compliments,8
84419,"guess the color challenge, too high, save it for later play! ! # funny # party game challenge#shorts",3
84431,"the book tied to 75,000 disappearances",7
84434,minecraft but i'm a crafting table!,2
84406,meet my boyfriend...,5
84636,surprised best friend with a yacht and this!,3
84637,pranking my guy bestfriend 😅😂 #shorts,7
84606,1 in a million coincidences! 🤯,5
84823,the diesel brothers surprised me with a military truck!,3
85023,billions season 6 (2022) official teaser | showtime,2
85001,minecraft but i battle the noob king,1
85219,[in the soop bts ver. season 2] official teaser 2,6
85223,took our bestfriends on a yacht! **elsy's bday**,4
85418,she will never forgive me!!,2
85419,this man has the longest nails in the world! 🤯,6
85431,buzzfeed unsolved: supernatural • season 7 trailer,1
85394,"the squid game cast reveals all including origin of the red light, green light doll | tonight show",2
85410,first look at the real housewives of beverly hills season 11 reunion | bravo,0
85452,i built spongebob's house in my backyard,8
85820,did i get it?!🤯🎮#xbox#playstation,2
85828,5 fake mexicans vs 1 real mexican | guess the liar,0
85837,the day that changed my life,5
85816,minecraft but pros rule the world,7
85838,backyard vibes,2
85800,madonna on madame x and getting into good trouble | the tonight show starring jimmy fallon,1
85810,this man can walk faster than you can run!,4
85867,i know your favourite athlete?🤔🥇#mindread,1
86027,basketball challenge = dares *extreme* #shorts #challenge,9
86038,"last to leave the pond wins $10,000",9
86213,[in the soop bts ver. season 2] official teaser 3,6
86267,did i get it?!🍿🤯🎥#mindread#movies,9
86415,wood fired hippie hot tub jacuzzi | fishing & smoking wild salmon - chanterelle hunting - ep. 143,7
86414,my experience playing sports,9
86409,official labor & delivery video | baby girl is here! 💖,0
86619,1v1 against devinthelab ... the full rematch !,9
86620,its not the frist time she tasted the rainbow! (squid games in real life),5
86635,try not to laugh #80 - luck of the dice,4
86599,have you ever seen a yellow laser?,8
86608,minecraft but i fight in the pro arena,3
86611,binging with babish: dalgona from squid game,8
86678,6 steak temps (ketchup - vampire) #shorts,6
86642,overtime 30 | outtakes,6
86794,revealing my new body! (mommy makeover),4
86800,i cooked a whole wagyu cow (ft. guga foods),5
86809,chef turns chick fil a into… an enchilada?!🤔,3
87020,labor and delivery for baby #11,0
87007,the end | moving out vlog,1
87013,yes or no (w/ crazy pranks & challenges) #shorts,8
87237,chocolate & coffee dry aged ribeye #shorts,4
87199,joe on tyson fury vs. deontay wilder 3,4
87200,i went to an amazon returns store,9
87396,dream - minecraft death shuffle extra scenes,3
87400,the demonic possession of the conjuring house,5
87401,we’re pregnant!!!! (16 weeks),1
87411,the story of minecraft steve,8
87619,chef nick digiovanni turns chick fil a… chinese?! 😳🇨🇳,3
87607,steak school: new york strip (strip steak) #shorts,6
87818,shane's new truck and finished office reveal!,8
87795,this monkey had an actual  job and never made one mistake! 🐒,7
87844,i'm so done.,0
88026,i have an announcement.,6
88012,if you don't love it when your coach does this something is wrong,5
88008,how i almost died buying my first smoker #shorts,8
88226,i can pull up my girlfriend,3
88231,morgan wallen - 865 (the dangerous sessions),6
88235,"asmr recalibrating your settings (pressing buttons on your face, typing, clicking)",1
88205,deanobballin shoots in front of fans while asking for a cure 🤯 #shorts,2
88398,grocery shopping chronicles | single life,0
88410,conjuring house q+a,2
88412,emma chamberlain & hailey compete in an “anything but your hands” challenge | game night with hailey,2
88620,i played squid game with 50 people!,7
88635,morgan wallen - livin' the dream (the dangerous sessions),6
88685,simply nailogical: the creation of a brand,9
88800,the horrors of villisca ax murder house,6
89029,we bought a cheap old camper to use as a cabin! (needs work),0
89003,"spending $100,000 to have the strongest ship in the game (build a boat to treasure)",7
89223,*new* airpods 3!,3
89226,building a 5 acre pond! (filling it with water part 2),1
89215,baby rates our halloween costumes! *he cries*,1
89205,new 16in and 14in macbook unboxing | m1 max and m1 pro,1
89213,i pulled up on nick briz...,1
89249,is mr. beast burger even real? (lets find out)!,0
89421,build a raft battle (behind the scenes),7
89437,no pullup bar? try elbow presses,9
89393,i broke the long jump world record unofficially,4
89617,lil meech goes off after big meech's old friend talks down on bmf!,2
89615,hasan minhaj reacts to impressions of hasan minhaj,3
89598,shaq making normal objects look tiny #shorts,8
89819,revealing my *breast surgery results* (emotional),4
89821,so i acted like i’m crying myself to sleep to see how my bfs reaction then he did this🥺🥰,8
89796,moving back to california?... living in los angeles for a week!,8
89800,"minecraft, but the world is upside down!",7
90005,sidemen squid game on gta 5,8
90040,any of you knows what puff is doing? #thatlittlepuff #halloweenlook #shorts  #puffknowsbetter,4
90044,savage dad vs bully's dad | #shorts  | jeremy lynch,4
90229,my biggest pet peeve,2
90201,the gettysburg ghosts of farnsworth house inn,0
90422,at the morning run with my dog 🐶 #animal #pets #short #dogs,0
90436,the mandela catalogue - exhibition,6
90404,announcement time,6
90593,introducing the alabama chromosomobile.,4
90610,extreme pantry organization | organizing vlog,3
90642,this could finally get ksi cancelled,0
90825,the labrant family 2021 halloween special!!!,3
90826,my students are funny but crazy 🥲,8
90797,slip n’ slide penalty challenge!!,2
90805,elsy’s jail experience + is she dating?! - the nopales show ep. 6,6
90843,is raw fish safe to eat? michelin chef answers,5
91030,sidemen 8 year anniversary on gta 5,0
91217,alex cooper & hailey bieber snack on ny bagels & play a game of heads up | who’s in my bathroom?,4
91220,major upsets in legislative races as results trickle in,7
91193,"minecraft, but the world is corrupted!",6
91203,you laugh you lose (hot wings edition),6
91420,the day shane came back to youtube… an intense 24 hours in our lives!,9
91421,"why i, janelle rohner, quit the keto diet",5
91423,i’m having regrets… what’s going on with my house,9
91431,subscriber destroys my golden play button 😭 💔 ( 24 hour challenge),9
91400,b-lovee - my everything (official video),0
91401,kay flock- 'being honest' remix (ft g herbo) [official video],2
91405,stranded and alone...,5
91414,about my mom.,2
91481,baby's 1st family bbq! *must watch*,0
91828,i mined 100 pounds of silver ore and turned it into a ring!,2
91803,the return of faze jarvis,7
92020,but wait 👀 the end 😭✋ #shorts,4
92235,we cleaned the beach #shorts #unfckitchallenge #teamseas,6
92202,try not to laugh challenge #82 - hard mode!,4
92205,listerine vs. tuna #shorts,2
92250,minecraft short videos #minecraft #shorts #trending (4),4
92420,how? minecraft #shorts,1
92424,i found something upsetting under my floorboards...,7
92425,dog reviews food 🐶🍗🍖 [funny dog reaction] pretending to put my dog on a diet 😍😘,8
92398,i built mrbeast’s squid game,8
92404,carmen and corey official gender reveal!! it’s a …,0
92453,officially signed michael jordan basketball,6
92619,extreme sidemen advent calendar forfeits,4
92627,my diy halloween costumes 2021 | charli d’amelio,6
92593,ryan reynolds shows up instead of will ferrell | the tonight show starring jimmy fallon,1
92640,dog turns around quickly when owner barks at him,7
92796,taylor swift’s 10-minute version of all too well almost wasn’t recorded (extended) | tonight show,5
92804,fivio foreign - squeeze (freestyle) [official video],4
93023,both of them woke up & chose violence (melons prank gone wrong) 🍉💀 #shorts,3
93074,box of lies with taylor swift | the tonight show starring jimmy fallon,1
93083,mark tuan - last breath (official music video),4
93219,when chef mike is on overtime [#shorts] 👏👏,6
93231,movie theatre life hack 💰,0
93201,painting my house!! *i'm not qualified for this*,2
93207,b lovee - talk about it ( official video),0
93252,funny photos that made me laugh,6
93259,toothbrush from france 🇫🇷 ! #shorts,8
93422,building a 5 acre pond! (filling it with water part 4),1
93431,guess what...we're moving!!!! (again...),0
93432,6 months pregnant & building an off grid forest cabin for baby | what we do at night - ep. 145,0
93395,#pov : you know everything🥺💰💔 #shorts #viral #smart #funny #meme #toys #money,8
93405,someone surprised me with flowers | day in my life,5
93594,"difficulty level 300,452,120 [#shorts] 👏👏",0
93596,nutty buddy vs. waffle maker?! #shorts,0
93602,spider-man no way home trailer 2 announcement exact time | tobey & andrew,6
93610,binging with babish: lunches from the breakfast club,9
93666,#pov : you know when you die🥺💔 #shorts #viral #sad #rip #meme #heaven #roblox #trending,4
93948,staining my white couch with permanent marker! testing if it’s really stain proof! 😱 #shorts,9
93832,when u get a new truck for free [#shorts] 👏👏,3
93802,staining my white couch with food coloring!! testing if it’s really stain proof! 😱 #shorts,4
93813,staining my white couch with red wine!! testing if it’s really stain proof! 😱 #shorts,5
93864,surprising alondra for her bday! *emotional*,5
94031,destiny wants to have another kid...😳😲,7
94009,telling our kids we're pregnant!!!,0
94223,"minecraft, but it's a straight line!",7
94227,pov : the nerd becomes a mafia boss 😳😍💥 #shorts,9
94234,what the squid doin,2
94237,buying my dream house!,8
94194,melting every soap from lush together,2
94200,i watched spider-man: no way home trailer in 0.25x speed and here's what i found,0
94417,return to the demonic sallie house,4
94428,the biggest day of our lives! getting ready for the wedding...❤️,9
94595,the official wedding of the royalty family,0
94599,coming to an end!,5
94602,riss and quan's official labor and delivery!!!,0
94603,hide and seek close your eyes! - difficulty very hard,2
94820,squid game behind the scenes,8
94809,my next boxing opponent,5
94815,walmart workers are something else 💀😭 #shorts,6
95026,reacting to our edits 🥰💞 @famous nunu,9
95032,givēon - heartbreak anniversary (live at american music awards),1
95033,"asmr face customization clinic (unintelligible, face touching)",4
94995,euphoria | season 2 | official tease | hbo,1
94999,my crush gives me the ultimate makeover!!,6
95002,unreleased footage | alaska bucket list,8
95011,try not to laugh challenge #83 w/ fiona nova,2
95217,grm *are me and justin still together *,9
95226,caught on camera! paranormal footprints leading away!,5
95199,i opened $1500 worth of scam items,1
95200,pixar stop making your characters look like me,8
95202,"i fed 10,000 families for thanksgiving!",4
95248,easy pencil drawing pencil drawing for beginners pencil drawing scenery #shorts # 1492,4
95422,where do we go from here??,0
95424,introverts be like.. 😭,0
95414,i have to vent.,4
95395,"travel with me | new boo revealed!? first fashion show, food and more",4
95411,finally bringing our baby home! *emotional*,0
95624,hardest riddle you've ever heard! - are you smart?,1
95600,profit from a stock crash… 💥,3
95819,i moved..,9
95822,green dry aged turkey #shorts,6
95834,installing our wood stove before snowstorm! / outsider log cabin build,1
95835,$6 sauce vs. $185 sauce,1
95804,sad girlz luv money - enola bedard & augusto,6
95838,i built a giant lego train in a snowy forest!,7
95839,busted | are we really off grid?!,2
95843,sidemen manhunt in gta 5,1
95844,deck planking - lining out (tally ho ep111),5
95849,ice cream battle… who do think is gonna win?! 😂🍦,5
95859,9 year old savage dad vs bully,4
95855,i'm not crying,0
96025,1 minute asmr with asmrtist friends,1
95991,imagine vaping 🤡 😂,0
95998,our house story...,8
96040,my pregnant wife was hospitalized | trent and allie,3
96296,makeup tips & tricks 🔥 #shorts .(5),5
96222,the real reason why we didn't go with nelk...,9
96224,things my students do that i just don’t get pt. 24 #shorts,1
96232,surprising our daughter with a trip to disneyland! not the reaction we expected 🤣,5
96204,a week in my life: i literally don't know where i live lol,5
96208,why i left twitch.,3
96209,"slay it don’t spray it w/ ariana grande, kelly clarkson, blake shelton & john legend | that’s my jam",3
96242,we've got something to share...,5
96243,it's worse than i thought... (houseboat update),3
96248,i got banned on roblox...,2
96418,"non-uniform days, in british schools versus american schools!",1
