,video_title,title_topic
145207,welcome to the hype house!!,8
145209,i went on a date! * we kissed*,1
145241,my future in super stadium truck racing...,8
145434,day in the life of a tiktoker who can't tiktok,8
145625,we got a surrogate!!!,1
145635,good good & rick shiels play a knockout golf challenge,1
146057,bennix is no longer my dog… (guide dog update),6
146055,busting 50 prank myths in 50 hours,3
146017,live - stadium super trucks nasheville race 1 w/cleetus mcfarland!,3
146011,we lost our camera gear & all our golf clubs..,8
146007,poppy playtime: chapter 3 - teaser trailer,1
146217,"extreme hype house hide and seek ($10,000)",8
146223,"hauling a 40,000 gallon water tank to a ghost town!",3
146211,jake paul vs. hasim rahman jr. (full sparring footage),4
146195,how to hand catch a coyote (feeding big ounce),8
146415,our $3m dream house tour!!!,4
146394,insane 4 month body transformation (heath hussar),0
146406,seeing my toxic ex for the first time in 2 years!!!,9
146408,im going to court over the baby!,4
146409,spontaneous family pictures ended up like this!  *must watch*,0
146411,kandi & tiny - if u get caught (official music video),3
146625,"grwm: first day of school 2022! |4am morning routine, what's in my bag, finding an outfit, & more!",6
146613,testing my girlfriends innocence,7
146829,hype house would you rather!!,8
146833,back to school shopping *vlog/ haul/ q&a*,0
146815,lori harvey spills how she’s grown through dating | bumble presents luv2seeit with teyana taylor,5
146851,maddie ziegler & hailey bieber eat sushi and do a blindfolded art challenge | who's in my bathroom?,8
146855,my birthday did not go as planned!!,5
147032,testing my boyfriends innocence,7
146999,welcome to my office! official skkn by kim office tour,0
147001,bam margera spent an entire year in rehab - steve-o's wild ride! ep #119,3
147003,our daughters name reveal!,9
147004,our official gender reveal! (finally goes right) 💙💖,0
147223,i jinxed it with my overconfidence,8
147196,giving school supplies to the poorest schools in america,9
147210,the worst fanfics i could find,5
147285,"first drive of my 2,000hp hypercar!! | nico rosberg x rimac nevera",0
147414,i threw a concert in my backyard..,8
147394,heat wave | hottest summer days living off grid,8
147402,i fed a wasp nest to capybaras (big ounce dies),5
147635,my own popsicle! (i ate it!),9
147612,building a 5 acre pond! (adding cypress trees and structure),1
147604,death valley flood destroyed our road...is this the end?,2
147614,deep diving my cringe 2015 tumblr (pt. 2) | brittany broski,7
147825,camila cabello turns up the heat | nbc's the voice,1
147812,swarmz - ksi diss track [music video],6
148032,our official gender reveal! 💙💖,8
148006,i built mrbeast’s 100 million playbutton!,8
148231,my first week living alone…,8
148233,the official blooper reel | euphoria: season two | hbo,1
148194,i stayed overnight in an underwater hotel,1
148200,24 hours with emma chamberlain in copenhagen | vogue,7
148433,cooking my go to meal with my sister! | protein power bowl!,4
148416,blackpink pink venom was terrible,7
148396,bailey zimmerman - where it ends (lyric video),9
148399,how to work for mrbeast,6
148619,flooring the cabin during a thunderstorm! / ep97 / outsider cabin build,0
148670,asake - terminator (official video),2
148659,building behzinga's new setup,2
148814,our wedding is canceled because of this...,3
148812,big update!,1
149029,home depot 1v1v1 build your own amphibious vehicle challenge!! ($200 go kart conversion),5
149030,return to the survival bunker- i can't sleep.,3
149004,ive 아이브 'after like' (out now ver.),6
149008,weeks ahead trailer | house of the dragon (hbo),1
149276,my satisfaction,0
149425,"asmr classmate draws on your face ✍🏼 (personal attention, mouth sounds, fidget toys & face tracing)",5
149437,"how i spent $38,000 on a lemonade stand",7
149617,my surprise bday trip!! *24 hours in nyc*,2
149631,what i eat in a day *realistic,0
149612,my husband surprised me with my dream car!!,3
149613,our house is done... now what?,4
149820,catherine's birthday special... **surprising her with a helicopter**,5
149810,mark zuckerberg answers to facebook's moderation of controversial content,1
149806,rest in peace my beautiful wife,4
150022,i went on my first blind date...,1
150197,my reaction to my fight against slim,9
150200,the worlds fastest general lee can run from any cop (1600hp twin turbo ls),2
150419,how things are going....,4
150424,moving out to college!!,4
150412,building a 5 acre pond! (hand feeding the bass),1
150400,episode 3 preview | house of the dragon (hbo),1
150405,my new shop flooded! - here's what happened (we had to start over),3
150621,i got knocked out,2
150626,revealing my new hair color!,4
150638,king kenny's honest thoughts on our fight.. (post fight reaction),9
150643,i destroyed the biggest boat in from the depths,2
150816,i was invited to cannes film festival,3
151038,moving into my college apartment part 1,4
150991,“we cry together” - a short film,3
150992,finding out i'm pregnant! again!,0
150994,why i took a break + what's next for me,4
151222,telling my family a baby is coming soon!!,0
151223,telling my son i'm pregnant! *emotional*,0
151214,nat's 19th birthday surprise party *she had no idea*,7
151205,married on our 1st date! | dhar and laura,8
151210,fivio foreign - god did freestyle (official video),4
151238,alex warren - headlights (official music video),0
151247,reaction on my fight against ksi & reaction to ksi vs pineda !! 😂,9
151248,rescuing fish stranded in a mud pit! (draining a stocked pond),5
151476,jid - kody blu 31 (official music video),4
151449,update on my corgi's cancer treatment || life after college: ep. 743,3
151451,if your phone was a person,3
151454,full off grid log cabin tour,4
151612,our best metal detecting find yet! plus...a road update,3
151820,i legally made my cat a lord!,7
151814,we’re pregnant!,0
151811,no going back | taking grid power away,4
151796,season 1 episode 4 preview | house of the dragon (hbo),1
151803,our big secret we’ve been hiding,4
152016,i’m pregnant,0
152001,“all out 2022” - being the elite ep. 322,5
152235,youtube is killing twitch,3
152194,addressing the screaming dog controversy,5
152242,binging with babish: wasabi buffalo wings from the simpsons,2
152410,telling my husband i'm pregnant! again!,0
152413,dan and phil finally tell the truth,8
152632,noah & i left the whole family for this. it was epic!,3
152641,death of queen elizabeth ii announced at buckingham palace,2
152836,i'm fighting anderson silva.,1
152816,surviving on $0.01 for 24 hours! *emotional surprise*,2
152812,i filled my island house with ball pit balls!,7
152814,morgan wallen - you proof (official music video),6
153021,national treasure: edge of history | official trailer | disney+,5
153023,college move in day vlog at fordham university | dear adulting ep2,6
153026,"i challenged nick eh 30 to fortnite trivia for 1,000,000 vbucks...",9
153001,teaser | percy jackson and the olympians | disney+,5
153008,teaser | the santa clauses | disney+,5
153051,it's fight day!!!,9
153218,2022 mullet championships,0
153230,building a 5 acre pond! (adding 300 goldfish),1
153234,season 1 episode 5 preview | house of the dragon (hbo),1
153196,kylie’s glam bar: kris jenner,2
153209,our first ever vidcon!,0
153414,sherri series premiere with kandi burruss & kym whitley,9
153413,walmart 1v1v1 build your own stealth shelter! (hiding from game warden),0
153621,service for the reception of the coffin at westminster hall,7
153593,we moved back to new york city,9
153597,the day after the fight!,9
153606,iphone 14 pro max vs. every other camera?,7
153609,kris and kylie go live to celebrate the launch of the kris collection,0
153667,good good plays the world’s best par 3 course | good good cup,4
153835,revealing the new good good house...,4
153805,how this blind surfer got 1millions subscribers in a month,3
153845,exposing my worst song,4
154024,bailey zimmerman - never leave (lyric video),9
154224,meet our daughter,5
154226,morgan myles stuns coaches with leonard cohen's hallelujah | the voice blind auditions 2022,2
154227,our family is having another baby!!! *we've kept this a huge secret*,8
154211,people are running to walmart for this..,7
154205,i tried bleaching my hair at home like a rebellious teen …but i'm a 30 year old lady (new hair),9
154239,off grid living | building another solar array,7
154245,different types of gamers,1
154435,dd osama x deon - chosen ones (shot by @bow mugz ) (official video),6
154474,a day in my life in college (nyc) | dear adulting,9
154591,season 1 episode 6 preview | house of the dragon (hbo),1
154605,our big reveal!...can't believe it's finally ready,8
154828,mikey williams: “saying i’m overrated is a trend.” | i am athlete,2
154832,blake shelton & kelly clarkson duet 'austin' | sneak peek!,8
154814,new house tour!!,4
154810,birth vlog | labor + emergency c-section,1
154811,"girl talk while i do my makeup | being bi, marriage, going back to an ex, balancing life and more..",4
155017,i challenged grant horvat to a stroke play match,2
155023,overnight in world’s cheapest 5 star hotel!,6
155010,a lesson in farm physics and hand signals brought to you by onyx,8
154999,my new life in nyc,9
155037,binging with babish: footlong taco dog from bob's burgers,4
155064,nest with me|preparing for baby￼|37 weeks| jazlyn mychelle,1
155044,teenager alyssa witrado sings no doubt's don't speak for gwen | the voice blind auditions 2022,0
155232,my labor + delivery storytime,0
155215,"santa fe klan, tornillo, doom deca - vuelo (video oficial)",0
155427,installing a pop up camper on my pontoon boat!!,4
155431,our dream house tour || *fully renovated & furnished*,4
155413,hotboy wes - renegade (feat. finesse2tymes) [official music video],3
155401,bigwalkdog - for certain (feat. big30) [official music video],4
155620,federer and nadal walk-out | laver cup 2022,0
155823,you all don't know the real me…,2
155796,i went to 12 anime cafés,9
156026,a flood destroyed our road...again,2
156034,alone,0
156014,season 1 episode 7 preview | house of the dragon (hbo),1
156001,working on our other shipping container!,1
156006,where i'm going from here,9
156040,some sad news,1
156042,i just bought a hidden abandoned chateau ruin,6
156043,the storm was scary | live update from the geodesic dome,3
156046,kevin met tommyinnit in real life…,4
156214,"everyday with de’arra | omg he dmed me, getting deep, lorvae shoot, party bus adventures and more",5
156212,niko vs the sidemen ft speed,0
156198,i finally bought my first home ever! *exciting*,4
156208,we were taken advantage of... (we confronted her for the truth),8
156418,obliterating the land speed record in kerbal space program,4
156434,special announcement!!,6
156414,parijita bastola's four-chair turn performance of labrinth's jealous | voice blind auditions 2022,1
156408,"well nyc, today is the day",9
156413,baby girl lanning name reveal! 💖,8
156441,sidemen rank the charity match players,3
156592,mixing every lip gloss from sephora together,7
156827,mixing every oreo flavor together,0
156810,addressing the hate comments,9
156991,monstermax 2 initial testing + trial update,5
157002,we adopt a son for 24 hours w/ royalty family,0
157039,finding out the gender of baby #2!,8
157246,i choreographed their first dance! (roni & aarons wedding),9
157393,montana has a tumor in her head,9
157397,our official gender reveal!!! baby number 2,8
157440,fortnite tiktoks you need to watch!,7
157467,season 1 episode 8 preview | house of the dragon (hbo),1
157636,this kitten cured my depression,2
157615,an unexpected change...,7
157607,first time at disneyland.,6
157832,i survived the conjuring house,2
157812,baby #3 is on the way!  |  first doctors appointment!,0
158013,asake - joha (official video),2
158003,we're moving!,4
158393,que vas a hacer - nivel codiciado x jose mejia (video oficial),1
158615,the power of artificial intelligence,2
158633,on sept. 26th my life changed unexpectedly! life altering turn,5
158609,landrew (official music video),2
158644,tally ho's remarkable new sailing dinghy,7
158834,i went undercover in sypherpk’s 100 player fashion show!,0
158813,we adopted my dog's dad!!!!! (like literally moose's real dad),4
159009,we tried every viral kardashian product..,0
159218,charli d'amelio and mark ballas jazz (week 4) | dancing with the stars on disney+,4
159233,the best results i've seen yet! (progress update),3
159235,the data log from mullet's 6.54 - 221mph pass at fl2k - all the boost!!!,6
159197,we got engaged,1
159415,we're moving...,4
159413,silky reacts to kyle richh x tata x jenn carter (41) - notti bop (official music video),6
159629,finally ending our beef...exposing the truth of what happened to ssh,8
159630,r.i.p. mom 💔,2
159613,the aftermath,6
159607,jayco & val engagement video,3
159815,acc | women's asia cup 2022 | final | india vs sri lanka,6
159810,i built the biggest lego sets ever released!,8
159844,are san marzano tomatoes actually worth it?,1
160019,we followed a vintage chicken jello recipe,7
160228,i got a $450 celebrity contouring facial,9
160203,stray kids super board video,8
160208,season 1 episode 10 preview | house of the dragon (hbo),1
160424,bloopers - ghost hunters 3,3
160425,our reaction to our babys first steps!,0
160432,trying pepsi s'mores + big announcement,0
160471,exploring the world's messiest girl group: fifth harmony,7
160629,former navy pilot ryan graves on his ufo encounter,7
160596,charli d'amelio and mark ballas contemporary (week 5) | dancing with the stars on disney+,4
160608,big baby update! our next step!,1
160674,surprising baby mama w/ customized tesla! *she loved it*,1
160643,revealing our kids new beautiful jungled themed playroom!!! *extreme makeover*,6
160820,silent hill transmission (en) | konami,5
160799,spot the short king,2
160810,"i bought a 64 person enclosed life boat off facebook marketplace!! (it weighs 20,000 pounds...)",3
161006,how is this possible!? noahs 18th birthday party.,7
161007,tiny trailer camping,9
161217,diesel tank disaster,3
161193,im pregnant... | sophia grace,4
161198,...wow,8
161243,feeling shady..,1
161431,revenge and tnt are gone,7
161394,the official tour of the new royalty palace!,4
161620,jaiden experiences mario ddr,8
161597,lindsay's pregnant* baby #2,8
161607,building a 5 acre pond! (adding crawfish),1
161638,alone in the woods: preparing the homestead and cottage for winter,5
161650,what happened...,3
161816,what happened to my abandoned house...,3
161822,the absolute button,9
161824,wow….we’re a family of 10 now!,8
161802,i almost died (not clickbait),3
162002,our new house tour!!!,4
162003,charli d'amelio - if you ask me to (official audio),4
162045,jake paul vs. anderson silva (official music video),9
162195,the santa clauses | official trailer | disney+,5
162207,charli d'amelio - if you ask me to (official video),4
162263,i can't believe this happened...,7
162420,will this halloween disguise fool my wife?,8
162427,ocean fishing & trading campers with mav,2
162401,technoblade never dies,6
162400,youngboy never broke again - with me,2
162631,i turned my terrible online purchases into halloween costumes,1
162604,tinder nightmares 5,8
162608,"foreign teck, anuel aa - el nene (official video)",4
162825,reacting to my first youtube videos...,9
162803,watching movie trailers and guessing their review scores,2
162809,today i make history.,8
163007,meet our new family members!… the best day of our lives so far!,9
163039,...now what?,0
163212,kylie jenner & hailey bieber toast to halloween with spooky cocktails | who's in my bathroom?,8
163206,i tried to make a viral tiktok filter,8
163412,venture x card - multiple taylors :30 | capital one,9
163397,dd osama - letter 2 notti (official video),2
163398,an emotional week.. i never thought this would actually happen,3
163626,i love this show,3
163597,you win...,5
163601,"kids cheat mrbeast for $1 million, they instantly regret it | dhar mann",8
164031,the end of a chapter...,9
164204,i opened a real theme park!,1
164206,overnight in world's most luxurious airport!,6
164415,building a 5 acre pond! (adding lily pads and vegetation),1
164423,bella woke up nauseous￼…￼,7
164426,crazy boatbuilding joinery / new tanks!,3
164427,we mixed 70 tons of concrete to finish the basement!,2
164393,the hardest thing i've ever done,4
164610,we did it again!!,5
164612,dirt biking in the tn hills with my boys! chaos!,6
164825,is parmigiano reggiano actually worth it?,2
164793,i tricked everyone into thinking i cut my hair,2
164999,i tried the rock's cheat meals for 30 days,8
165216,we're pregnant!!,0
165214,jaiden experiences digi-torture,2
165419,stone hearth install during first snow! + injury update  / ep100 / outsider cabin build,1
165437,i opened a gourmet restaurant for foxes!,5
165444,baby number 2 middle name reveal! + 22 week pregnancy update,8
165621,facing my #1 biggest fear,0
165622,i hate video game mystery boxes,7
165604,judging crazy r/aita people,2
165612,weekend in my life in nyc!!,3
165825,we played a golf match with lando norris!,5
165826,here we go again!!!,0
165837,my pregnant golden retriever gives birth to 12 puppies! | episode 7,7
165811,"press this button for $50,000?",7
165806,we’re moving!!!!,4
165810,"i did 10,000 random acts of kindness for world kindness day",8
166041,meet my 1 day old golden retriever puppies!,7
166232,eddie hall's punishment! 34° frozen lake plunge,8
166191,kendrick lamar - rich spirit,5
166201,this look changed my life,5
166205,i built the worlds largest working computer!,3
166488,will the sharks take a sip with prontobev? | shark tank us | shark tank global,9
166431,caddy jack's maiden voyage! this small block sounds insane!!,1
166634,bedroom reveals! house tour: part 2,9
166601,"i opened 1,000 packages",1
166610,our baby’s gender reveal!,8
166643,eddie hall has a better grip than me?? | ft. robert oberst and nick best,1
166646,my last 5 months,0
166648,making big changes to my house… *i finally got my building permit!!*,2
166829,my 2 new albums are out now...are they my last? 💔,2
166807,i bought my mom a car!,4
166853,pokemon scarlet & violet shocked me... | review,7
167017,the official gender reveal of the royalty family!,8
167023,traditional wood boatbuilding - deck hatches & more!,3
166993,guy rates his exes,4
167008,i traveled to a hello kitty resort!,6
167044,rc monster truck catches colorful fish for prime.,9
167215,cutting my dreads off after 15 years!! (surprise to my girlfriend),0
167219,reality dating shows are taking years off my life 😀🙌,9
167228,building a 5 acre pond! (tagging our pet bass),1
167405,“carry on” - being the elite ep. 323,8
167634,bringing my syrian parents out of metro manila 🇵🇭 (province life!) 🌿,5
167671,top 3 predictions that bob iger will now do to the disney parks,5
167790,project: playtime - official cinematic trailer,1
167836,i surprised david dobrik with a custom tesla!,0
167794,finding out we're pregnant (together with baby #3),0
167997,project: playtime - official gameplay trailer,2
167999,ishowspeed goes shopping for sneakers at kick game,0
168041,am i doing vlogmas? | ad,6
168228,she wants it back!!,6
168236,"our $1,000,000 dubai vacation",4
168195,the mandela catalogue vol.4,6
168248,somebros friendsgiving,1
168257,¡invasión mexicana en qatar! - vlog en el mundial,9
168395,i tried the worlds #1 slice of pizza,8
168452,how i really feel about being pregnant..,8
168598,letting shane control the day… an extreme 24 hours in our lives,0
168821,binging with babish: sausage from god of war: ragnarok,7
168829,the truth,1
168830,they didn’t like where i took them!,9
168813,"gender reveal! after 3 boys, baby is a.....!!!!",8
169028,minecraft players simulate world extinction,6
169015,water testing 64 person enclosed lifeboat for the first time!!,3
169014,huge drama in the smash community,4
169001,73 questions with jennifer lopez | vogue,7
169011,telling our family we’re pregnant!,0
169196,monstermax 2 running on twin engines!!!!,3
169209,i had the perfect day in the metaverse,2
169210,[skz vlog] felix : sunshine vlog 5 in australia,5
169414,we're pregnant! *baby #2*,0
169626,our chaotic family christmas competition...,3
169816,goodbye grant & micah,8
169826,everything must move!  entire shop rearrange!,0
169837,finding out i'm pregnant! again!,0
169795,hiker gets eaten alive... and lives,0
169843,$13 shrimp vs. $27 shrimp,8
170017,making our dreams come true… shocking reveal!,8
170038,we got a new puppy (frenchie),2
170222,3 things i learned from 800 days of vlogging,6
170230,amber riley & jennifer hudson sing ‘and i am telling you i’m not going’!,2
170199,try not to laugh challenge #109 w/ kallmekris,2
170238,mommy and son surprise daddy with pregnancy announcement!,9
170421,creating minecraft's most advanced military,0
170432,i built a giant spider-man!,8
170399,i built a lego train around my ceiling!,8
170445,generation loss: the social experiments official teaser,5
170450,viewers pick dan's outfits,4
171020,revealing our baby's name! 😱,4
171001,i became a dj to prove that it's easy,9
171003,"extreme $20,000 airplane seat!",0
171215,$4 pork vs. $19 pork,0
171397,my 2022 year in review,0
171407,surprising shane with his dream… he never expected this!,1
171409,"$50,000 rock, paper, scissors tournament",7
171626,simple oil leak fix becomes massive headache! now we've gotta pull the transmission apart...🤦‍♂️🤷,2
171600,help my out of control 14-year-old sister! | karamo,4
171818,queen leora & dada1k gender reveal,1
171819,could you survive the end of the world?,7
171806,and the winner of the voice is... | nbc's the voice live finale 2022,1
171998,i built mrbeast a real life fortnite battle bus!,0
172003,why we broke up....,2
172005,the live birth of our baby girl,8
172228,festive treehouse camping,8
172231,crazy go kart with crotch rocket motor!,1
172191,kendrick lamar - count me out,5
172399,$14 seafood vs. $48 seafood,2
172627,we flew street kids to the soccer world championship,1
172635,stephen 'twitch' boss' mom speaks out + note found at scene of his death,2
172636,$100 lost amazon package survival challenge!,8
172594,trying to find my girlfriend blindfolded!,7
172605,30 years at the bottom of lake powell... the yellow submarine arrives for tear down,9
172651,building tally ho’s rudder using hardwood & chainsaw-mill!,3
172826,i sent a quiz to all the boys ive loved… again,1
172812,we’ve been waiting for this!!!… an exciting 24 hours in our lives!,9
172798,streaming in 2023 | feels like home | disney+,5
172809,meeting online friends irl,4
172854,our toddler meets his baby sister for the first time!,1
173015,surprising my wife with rod wave concert tickets,4
173225,tesla model s plaid owner's review: things i love and hate!,3
173190,deion sanders receives his flowers from shannon sharpe | ep. 65 | club shay shay,6
173193,unbelievable! the yellow submarine engine starts up after being under the water for 30 years!,4
173242,i said yes,9
173419,sneaking my brother out of school!!,9
173425,how i'm feeling | vlogmas day 18 + 20,5
173596,episode 1: this is me. (overcomfort podcast with jenicka lopez),7
174029,building vikkstar123 setup,9
174006,what dan and phil text each other 2022,0
174008,tom macdonald - ghost,5
174390,kim kardashian | angie martinez irl podcast,7
174601,winter storms on the way-time to stack the new shed,4
174815,"sofie dossi talks about america’s got talent, dealing with heartbreaks and more! | dhar & jay show",4
174801,christmas morning 2022 opening all of our gifts! huge surprise! emma and ellie,0
174809,a first time mom's very raw and real labor and delivery story,0
174995,i beat minecraft in antarctica,7
174997,overnight mountain train trip (via rail),1
175000,completing my winter bucket list!,7
175216,newjeans (뉴진스) 'ditto' performance video,8
175198,"spending $1,000,000 filling my house",1
175204,we're rebuilding homes in kentucky for tornado survivors,5
175415,finishing the fiberglass repair on my houseboat!! (1 year of work),1
175414,best emotional surprises for my sister!,1
175604,got the beat 'stamp on it' stage video,7
175822,london vlog,1
175797,our biggest announcement yet..,2
175814,why i left youtube... life update grwm,9
176013,im single,0
175993,i built a giant lego castle for my cats!,8
176004,i built pixar’s cars in real life!,8
176221,bts of reece & rays proposal 😭❤️,1
176194,officially announcing my first mma fight.,9
176411,make semi trucks shiny again!,3
176613,our official gender reveal || baby #3,8
176815,【debut stream】finally made it to guild tempus! #shinri_debut #holotempus,3
176817,【debut stream】prepare yourselves for the greatest show on planet earth! #bettel_debut #holotempus,9
176827,tally ho’s brand new diesel tanks!,3
176807,taking our brand new car on a roadtrip,1
176808,【debut stream】get in the robot? okay :) #flayon_debut #holotempus,5
176810,【debut stream】evil spirits? not on my watch! #hakka_debut #holotempus,9
176847,hello.,8
177022,we found out the gender of baby #2! *shocking*,8
177024,what just happened with lake mead shocked scientists!,3
177025,starting my bodybuilding journey!!! (olympia) - eddie hall,4
177030,our official baby gender reveal!!,8
177007,morr wiring on the world's largest off road wrecker,3
177067,are we quitting youtube??? | trent & allie,3
